{
  "name": "John Carter",
  "contacts": {
    "emails": [
      "john.carter@example.com"
    ],
    "phone_numbers": [
      "5879012301",
      "20182022"
    ]
  },
  "sections": {
    "full_text": "John Carter\nEmail: john.carter@example.com | Phone: 587-901-2301 | Calgary, AB",
    "summary": "Software Developer with 3+ years of experience specializing in full-stack development, cloud systems, and scalable API design.",
    "skills": "Languages: Python, JavaScript, TypeScript, SQL\nFrameworks: React, Node.js, Express, Django\nCloud: AWS, Docker, Kubernetes\nTools: Git, CI/CD, Postman",
    "experience": "Software Developer NexaTech Solutions (2022Present)\n- Built REST APIs using Express and PostgreSQL serving 50k+ monthly users\n- Developed internal microservices using Docker + AWS ECS\n- Improved query performance by 30% through indexing and optimization",
    "education": "BSc Computer Science University of Calgary (20182022)"
  },
  "extracted_skills": [
    "docker",
    "react",
    "postgresql",
    "python",
    "javascript",
    "django",
    "express",
    "typescript",
    "aws",
    "kubernetes",
    "ci/cd",
    "node.js"
  ],
  "full_text_snippet": "John Carter\nEmail: john.carter@example.com | Phone: 587-901-2301 | Calgary, AB\n\nSUMMARY\nSoftware Developer with 3+ years of experience specializing in full-stack development, cloud systems, and scalable API design.\n\nSKILLS\nLanguages: Python, JavaScript, TypeScript, SQL \nFrameworks: React, Node.js, Express, Django \nCloud: AWS, Docker, Kubernetes \nTools: Git, CI/CD, Postman \n\nEXPERIENCE\nSoftware Developer NexaTech Solutions (2022Present)\n- Built REST APIs using Express and PostgreSQL serving 50k+ monthly users \n- Developed internal microservices using Docker + AWS ECS \n- Improved query performance by 30% through indexing and optimization \n\nEDUCATION\nBSc Computer Science University of Calgary (20182022)"
}